{
  "dependency_edges": [
    {
      "sections": [
        "Getting Started — Adopting the Librarian in a New Project"
      ],
      "source": "README.md",
      "status": "pending",
      "target": "SKILL.md"
    },
    {
      "sections": [],
      "source": "librarian-buildout-plan-20260411-V1.1.md",
      "status": "supersedes",
      "target": "librarian-buildout-plan-20260411-V1.0.md"
    },
    {
      "sections": [],
      "source": "librarian-buildout-plan-20260411-V1.2.md",
      "status": "supersedes",
      "target": "librarian-buildout-plan-20260411-V1.1.md"
    },
    {
      "sections": [],
      "source": "phase-f-plugin-and-release-20260413-V1.0.md",
      "status": "supplement",
      "target": "librarian-buildout-plan-20260411-V1.2.md"
    },
    {
      "sections": [],
      "source": "phase-f-plugin-and-release-20260413-V1.1.md",
      "status": "supplement",
      "target": "librarian-buildout-plan-20260411-V1.2.md"
    },
    {
      "sections": [],
      "source": "phase-f-plugin-and-release-20260413-V1.1.md",
      "status": "supersedes",
      "target": "phase-f-plugin-and-release-20260413-V1.0.md"
    },
    {
      "sections": [],
      "source": "phase-f-publish-checklist-20260413-V1.0.md",
      "status": "supplement",
      "target": "phase-f-plugin-and-release-20260413-V1.1.md"
    },
    {
      "sections": [
        "Package structure — needs update for templates module"
      ],
      "source": "phase-g-templates-and-recommendations-20260412-V1.0.md",
      "status": "pending",
      "target": "librarian-architecture-20260411-V1.0.md"
    },
    {
      "sections": [
        "Execution plan — Phase G extends the A-F roadmap"
      ],
      "source": "phase-g-templates-and-recommendations-20260412-V1.0.md",
      "status": "pending",
      "target": "librarian-buildout-plan-20260411-V1.2.md"
    },
    {
      "sections": [],
      "source": "project_config.example.yaml",
      "status": "supplement",
      "target": "project_config.schema.yaml"
    },
    {
      "sections": [],
      "source": "project_config.full.yaml",
      "status": "supplement",
      "target": "project_config.schema.yaml"
    },
    {
      "sections": [],
      "source": "project_config.minimal.yaml",
      "status": "supplement",
      "target": "project_config.schema.yaml"
    },
    {
      "sections": [],
      "source": "project_config.schema.yaml",
      "status": "supplement",
      "target": "SKILL.md"
    },
    {
      "sections": [],
      "source": "registry.schema.yaml",
      "status": "supplement",
      "target": "SKILL.md"
    },
    {
      "sections": [
        "Security model and threat boundaries"
      ],
      "source": "security-review-20260413-V1.0.md",
      "status": "pending",
      "target": "librarian-architecture-20260411-V1.0.md"
    }
  ],
  "file_hashes": [
    {
      "exists": true,
      "filename": "README.md",
      "sha256": "aee22d8f056f754ba8349cd692a806bec2396ac074d162a582b075a86d506f6e",
      "size_bytes": 6033
    },
    {
      "exists": true,
      "filename": "SKILL.md",
      "sha256": "8ffdce4a53f11b9c32ce014b753e4d65523e4f87ae9264efdb7b332b909b449f",
      "size_bytes": 32690
    },
    {
      "exists": true,
      "filename": "bug-bounty-report-20260413-V1.0.md",
      "sha256": "a7654d9f6cf5d5d3bf937142dc309dc741646384d751679613d14e4eb2f4c91a",
      "size_bytes": 10499
    },
    {
      "exists": true,
      "filename": "example-manifest-20260411-V1.0.json",
      "sha256": "8f6a2248c173f6295270436f238b16c68f1a5cbea3561859f9782e1896d88165",
      "size_bytes": 1743
    },
    {
      "exists": true,
      "filename": "librarian-architecture-20260411-V1.0.md",
      "sha256": "4468ccd114c18c9d69557ba35f80ddc0d63886beeb4db0e948c8762521693047",
      "size_bytes": 9229
    },
    {
      "exists": true,
      "filename": "librarian-buildout-plan-20260411-V1.0.md",
      "sha256": "7512decc4824f7a7514c8bc5d9d0861dc0aac1747b2bbc5cdbeb54769638efc3",
      "size_bytes": 19955
    },
    {
      "exists": true,
      "filename": "librarian-buildout-plan-20260411-V1.1.md",
      "sha256": "fd51be57d9eaa7700e68d692dc3e77e3ea585c3bde1ccc901ead830d2aeeb3ad",
      "size_bytes": 21338
    },
    {
      "exists": true,
      "filename": "librarian-buildout-plan-20260411-V1.2.md",
      "sha256": "e43e0682bf84c862dcfca4559cb26e8c27358d16a07c8ffe1758886cdffeabdb",
      "size_bytes": 23580
    },
    {
      "exists": true,
      "filename": "librarian-dashboard-20260412-V3.0.html",
      "sha256": "8cde6bc0a3719e18590bc02fc20fa9e269716e94a15b99ef21b12bc028a24913",
      "size_bytes": 510979
    },
    {
      "exists": true,
      "filename": "librarian-evidence-20260413-V1.0.json",
      "sha256": "e45638206afaafff049448a998faf174bf985973b4cd39c700a7e9d9c19ec431",
      "size_bytes": 34894
    },
    {
      "exists": true,
      "filename": "librarian-manifest-20260412-V1.0.json",
      "sha256": "ecd81d5e3ea6b257a0deb9c5124bd6f968db0c09286da92d7cadf790328cca87",
      "size_bytes": 16761
    },
    {
      "exists": true,
      "filename": "librarian-manifest-20260413-V1.0.json",
      "sha256": "47070e0020b3383d3c449861e859e83e6e8a5bfadb6d3933f090832326a8e201",
      "size_bytes": 32021
    },
    {
      "exists": true,
      "filename": "manifest.schema.json",
      "sha256": "50e3a3d1e37a9ba83e89a5c71cfebe4cabee67f469926b7f504c94458860a76d",
      "size_bytes": 6038
    },
    {
      "exists": true,
      "filename": "phase-d-implementation-plan-20260412-V1.0.md",
      "sha256": "67d42a12fd383b401b452abeec702715ef675ad8f7d6de5a866768640c1ccd67",
      "size_bytes": 6381
    },
    {
      "exists": true,
      "filename": "phase-f-plugin-and-release-20260413-V1.0.md",
      "sha256": "23b5ac5279a59946156e2be3600606f74adfd85335a9283fc3ef32f7d824db87",
      "size_bytes": 9482
    },
    {
      "exists": true,
      "filename": "phase-f-plugin-and-release-20260413-V1.1.md",
      "sha256": "21f25f28bb14edf7b8414cb12875d4c92d80b0146f339fa97154de5b8a1dd756",
      "size_bytes": 12777
    },
    {
      "exists": true,
      "filename": "phase-f-publish-checklist-20260413-V1.0.md",
      "sha256": "c884bd08df8da41ba4ce4cf763f61bc6fdc4d3e2762750e3c039e7e0de48ea5a",
      "size_bytes": 8371
    },
    {
      "exists": true,
      "filename": "phase-g-templates-and-recommendations-20260412-V1.0.md",
      "sha256": "1c449715553bbd21b9126d4f6731cf4a210fec639ed0f7bf1a9adc09c3f726e0",
      "size_bytes": 31667
    },
    {
      "exists": true,
      "filename": "project_config.example.yaml",
      "sha256": "27ba6f3d55d440327d67d8aff13d65ffd4de982392b992e882ef223109faca05",
      "size_bytes": 2025
    },
    {
      "exists": true,
      "filename": "project_config.full.yaml",
      "sha256": "d3491f06a77ba7625df7d01689c935831fbce2bca869a8cba85182d234d6bb2f",
      "size_bytes": 2113
    },
    {
      "exists": true,
      "filename": "project_config.minimal.yaml",
      "sha256": "d2376bae1ac5a73da70a5372e11d5ca10c147f67a5cddb3acee9ce0e2a2fd2b2",
      "size_bytes": 204
    },
    {
      "exists": true,
      "filename": "project_config.schema.yaml",
      "sha256": "3f5553fe056f4072bbdce42e30d3fd91741e3a78cf4150c241d4d7e7ee223ab8",
      "size_bytes": 5329
    },
    {
      "exists": true,
      "filename": "registry.schema.yaml",
      "sha256": "52a0a0243b21fdeb127a512ba3457213a6b0435cc0fd92dc018deb2491cb7309",
      "size_bytes": 7702
    },
    {
      "exists": true,
      "filename": "release-notes-20260413-V1.0.md",
      "sha256": "b46f992bbcafe3954f22f17bfbb3e75a2fcb29ac5f4516f5d8e826b06d2991fb",
      "size_bytes": 2281
    },
    {
      "exists": true,
      "filename": "release-notes-20260413-V2.0.md",
      "sha256": "7b91e55bf82181d8f2d253bf435ad51e05adbd937da2d8d80be6a2b5447cb65a",
      "size_bytes": 3681
    },
    {
      "exists": true,
      "filename": "release-notes-20260414-V3.0.md",
      "sha256": "760a15a101f38df21c23b1d0baf619715ee80e63085c871085d9643e9bdf56b4",
      "size_bytes": 5991
    },
    {
      "exists": true,
      "filename": "release-v0-7-2-runbook-20260413-V1.0.md",
      "sha256": "a5779acfe949cd7eba4e40914f0ee65bb6d0992c01b4d0a8e4ccf0d333401ace",
      "size_bytes": 9056
    },
    {
      "exists": true,
      "filename": "security-review-20260413-V1.0.md",
      "sha256": "99138e935b04fc3a7b171175ba5fba94a0ae6508ab15d8e5d32d59b742472c03",
      "size_bytes": 13807
    }
  ],
  "manifest_sha256": "dcaca5c4b13972fefffe56617a88cd970a66233c6271b725a38c5a2ca61b24d6",
  "meta": {
    "generated_at": "2026-04-14T21:07:57Z",
    "generator_version": "0.2.0",
    "registry_path": "docs/REGISTRY.yaml",
    "repo_root": "/sessions/festive-zealous-bardeen/mnt/librarian"
  },
  "registry_snapshot": {
    "documents": [
      {
        "author": "Chris Kahn",
        "classification": "PERSONAL / INTERNAL USE ONLY",
        "cross_references": [],
        "date": "2026-04-11",
        "description": "Canonical skill definition for the project-agnostic document librarian. Includes Getting Started section and generic project_config schema.",
        "exemption_reason": "Filename is hardcoded by the Claude skill loader (SKILL.md). Date-version suffix not applied.",
        "filename": "SKILL.md",
        "format": "md",
        "infrastructure_exempt": true,
        "locations": {
          "chat": false,
          "cowork": true,
          "disk": true
        },
        "parent": null,
        "path": "skill/SKILL.md",
        "status": "active",
        "superseded_by": null,
        "supersedes": null,
        "supplements": [],
        "tags": [
          "governance",
          "skill-definition",
          "meta",
          "phase-a"
        ],
        "title": "Document Librarian Skill Definition",
        "version": "1.0"
      },
      {
        "author": "Chris Kahn",
        "classification": "PERSONAL / INTERNAL USE ONLY",
        "cross_references": [
          {
            "doc": "SKILL.md",